### ISSUE TITLE
Support one-way (worker->server only) network reachability

### ISSUE THREAD

**Issue by gitlawr** [gpustack/gpustack#4131]
### ❓ Is your enhancement related to a problem?

The current requirement for bidirectional (server↔worker) reachability expands the security attack surface and reduces deployment flexibility, as each worker must expose an open port to the server, making it unsuitable for environments behind restrictive NATs or in secured private networks.

**Comment by koko6888** [comment]
In dev deb7082

### Steps to Reproduce

1. Start GPUStack server on machine A:
```bash
docker run -d --name gpustack-server --network host \
  -e GPUSTACK_HOST=0.0.0.0 -e GPUSTACK_PORT=8080 \
  -v /var/lib/gpustack:/var/lib/gpustack \
  gpustack/gpustack:dev
```

2. Start GPUStack worker on machine B (inbound ports blocked) using the token from server:
```bash
docker run -d --name koko-worker \
  -e GPUSTACK_TOKEN=<worker_token> \
  --network host --privileged --runtime nvidia \
  -v /var/run/docker.sock:/var/run/docker.sock \
  -v koko-data:/var/lib/gpustack \
  gpustack/gpustack:dev \
  --server-url http://<server_ip>:8080 \
  --worker-ip <worker_ip>
```

3. Verify worker registered successfully — it does, with `proxy_mode: worker`.

4. Capture inbound traffic on the Worker machine:
```bash
sudo timeout 30 tcpdump -i any -n \
  "src host <server_ip> and tcp[tcpflags] & tcp-syn != 0"
```

5. Check Server logs:
```bash
docker logs gpustack-server 2>&1 | grep -E "10150|worker_request"
```

### Expected Behavior

After Worker registers with `proxy_mode: worker`, the Server should route all communication (including health checks) through the WebSocket tunnel established by the Worker. The Server should **not** make any direct outbound TCP connections to the Worker.

### Actual Behavior

**Tcpdump on Worker shows Server actively sending TCP SYN to Worker port 10150:**
```
192.168.50.16.53264 > 192.168.50.15.10150: Flags [S]  ← Server initiates connection
192.168.50.16.53278 > 192.168.50.15.10150: Flags [S]  ← retry
192.168.50.16.59678 > 192.168.50.15.10150: Flags [S]  ← retry
```

**Server logs show continuous direct healthcheck failures:**
```
ERROR - Worker request failed: 1 GET http://192.168.50.15:10150/healthz
ERROR - Worker request failed: 1 GET http://192.168.50.15:10150/healthz
...(repeating every 5s)
```

**Worker has no websocket_proxy code at all:**
```bash
$ docker exec koko-worker ls /usr/local/lib/python3.11/dist-packages/gpustack/worker/
# No websocket_proxy file found

$ docker exec koko-worker find ... | xargs grep -l "websocket_proxy"
# No output — keyword does not exist in the image
```

**Comment by gitlawr** [comment]
Use proxy_mode=tunnel

**Comment by koko6888** [comment]
Verified in dev f54b00d
